CleanedTweets,Tweets,Time,TimeNew,TimeChanged,PolarityScore
hey heard campaign paying partial recount guess biden win onl,"\"Hey @realDonaldTrump I heard your campaign is only paying for a partial recount in WI. I guess the Biden win is onl\\u2026 https://t.co/F643xbwEVM\"","\"2020-11-19 15:42:23.666044\"",2020-11-19T15:42:39.075+05:30,"",Positive
tell read book fucking poor people remember ivanka saying wrote,"\"\\u201c\\u2018Ly, why would you tell me to read a book about fucking poor people?\\u2019 I remember Ivanka saying,\\u201d she wrote. \\u201c\\u2018What\\u2026 https://t.co/uOKDiQzxDI\"","\"2020-11-19 15:42:26.669369\"",2020-11-19T15:42:39.075+05:30,"",Negative
eleicoes biden trump trumpvsbiden,"\"this...\\n\\n@EleicoesEUA @realDonaldTrump @JoeBiden #Eleicoes2020 #Biden2020 #Trump2020 #TrumpvsBiden https://t.co/RLrBnQGFSJ\"","\"2020-11-19 15:42:29.670620\"",2020-11-19T15:42:39.075+05:30,"",Positive
joke nin wisconsin votes injected nummmmmm election wisconsin,"\"Is this a joke!? \\n\\nIn Wisconsin, 143,379 votes INJECTED at 3:42AM\\n\\nUmmmmmm\\n#Election2020 #Wisconsin\\u2026 https://t.co/1y6e8jwobJ\"","\"2020-11-19 15:42:32.674920\"",2020-11-19T15:42:39.075+05:30,"",Positive
cshe trump radar status money power dad instinct throw others bus save,"\"\\u201cShe had the Trump radar for status, money, and power, and her dad\\u2019s instinct to throw others under the bus to save\\u2026 https://t.co/unu3RjNgp0\"","\"2020-11-19 15:42:35.676474\"",2020-11-19T15:42:39.075+05:30,"",Positive
president trump allow biden security briefings hasn conceded yet vote,"\"Should President Trump allow Biden security briefings if he hasn't conceded yet? Vote Now Here:\\u2026 https://t.co/xH6uq5aDI5\"","\"2020-11-19 15:42:38.678644\"",2020-11-19T15:42:39.075+05:30,"",Positive
